{
   "type" : "Ant",
   "size" :
   [
       5.0,
       5.0
   ],
   "friction_factor" : 0.0,
   "mass" : 1.0,
   "max_acceleration" : 0.0005,
   "cruise_speed" : 5.0,
   "vision" :
   {
      "angle_degrees" : 60.0,
      "distance" : 125.0
   },
   "decision_weights" :
   {
      "alignment" : 0.60000002384185791,
      "cohesion" : 0.10000000149011612,
      "separation" : 0.30000001192092896
   },
   "separation_potential_exponent" : 0.5,
   "world_situation" :
   {
      "acceleration" :
      [
          0.0,
          0.0
      ],
      "position" :
      [
          252.03352180301297,
          381.54048984341028
      ],
      "velocity" :
      [
          0.0,
          0.0
      ]
   },
   "colors" :
   {
      "blind" :
      [
          160,
          34,
          34,
          255

      ],
      "capped_force" :
      [
          160,
          34,
          160,
          255
      ],
      "default" :
      [
          34,
          160,
          34,
          255
      ]
   }
}
